{
  "format": "trestle-catalog",
  "version": 1,
  "generator": {
    "name": "trestle",
    "version": "0.0.0-test",
    "revision": "0000000000000000000000000000000000000000"
  },
  "catalog": {
    "baseline": "olai-stack-topology@test",
    "manifests": [],
    "digest": "sha256:04e7bfd3e89dfad2ac03854d62ed19adb513df8594339ca9f561e4851e4cb9aa"
  },
  "modules": [
    {
      "id": "envoy",
      "model": "envoy",
      "display_name": "Envoy",
      "summary": "Single-port gateway, Databricks-shaped URL rewrites.",
      "category": "gateway",
      "provider_of": "gateway",
      "requires": [],
      "conflicts_with": [],
      "resource_kinds": [],
      "resource_nouns": [],
      "knobs": [
        {
          "key": "image",
          "title": "Envoy image",
          "kind": {
            "kind": "string"
          },
          "default": "envoyproxy/envoy:v1.38-latest",
          "required": false,
          "help": "Container image reference (repository:tag or digest). Override to pin or test a different release.",
          "aliases": [
            "ENVOY_IMAGE"
          ],
          "advanced": true
        },
        {
          "key": "certs_image",
          "title": "Certificate minting image",
          "kind": {
            "kind": "string"
          },
          "default": "eclipse-temurin:17-jdk-noble",
          "required": false,
          "help": "Container image reference (repository:tag or digest). Override to pin or test a different release.",
          "aliases": [
            "GATEWAY_CERTS_IMAGE"
          ],
          "advanced": true
        }
      ],
      "helpers": [
        {
          "name": "gateway-certs",
          "kind": "init"
        }
      ],
      "hosted": null
    },
    {
      "id": "authelia",
      "model": "authelia",
      "display_name": "Authelia",
      "summary": "Forward-auth single-sign-on for the gateway (file-based).",
      "category": "gateway",
      "provider_of": "auth",
      "requires": [],
      "conflicts_with": [],
      "resource_kinds": [],
      "resource_nouns": [],
      "knobs": [
        {
          "key": "image",
          "title": "Authelia image",
          "kind": {
            "kind": "string"
          },
          "default": "ghcr.io/authelia/authelia:4.39",
          "required": false,
          "help": "Container image reference (repository:tag or digest). Override to pin or test a different release.",
          "aliases": [
            "AUTHELIA_IMAGE"
          ],
          "advanced": true
        }
      ],
      "helpers": [],
      "hosted": null
    },
    {
      "id": "postgres",
      "model": "postgresql",
      "display_name": "Postgres",
      "summary": "Postgres 16; auto-creates DBs other modules declare.",
      "category": "metadata_db",
      "provider_of": "relational_db",
      "requires": [],
      "conflicts_with": [],
      "resource_kinds": [
        "relational_db"
      ],
      "resource_nouns": [
        {
          "kind": "relational_db",
          "singular": "database",
          "plural": "databases"
        }
      ],
      "knobs": [
        {
          "key": "image",
          "title": "Postgres image",
          "kind": {
            "kind": "string"
          },
          "default": "postgres:16",
          "required": false,
          "help": "Container image reference (repository:tag or digest). Override to pin or test a different release.",
          "aliases": [
            "POSTGRES_IMAGE"
          ],
          "advanced": true
        }
      ],
      "helpers": [],
      "hosted": null
    },
    {
      "id": "rustfs",
      "model": "rustfs",
      "display_name": "RustFS",
      "summary": "Self-hosted S3-compatible object store with STS; answers the AWS S3/STS hostnames in-network.",
      "category": "storage",
      "provider_of": "object_store",
      "requires": [],
      "conflicts_with": [],
      "resource_kinds": [
        "object_store"
      ],
      "resource_nouns": [
        {
          "kind": "object_store",
          "singular": "bucket",
          "plural": "buckets"
        }
      ],
      "knobs": [
        {
          "key": "image",
          "title": "RustFS image",
          "kind": {
            "kind": "string"
          },
          "default": "rustfs/rustfs:1.0.1",
          "required": false,
          "help": "Container image reference (repository:tag or digest). Override to pin or test a different release.",
          "aliases": [
            "RUSTFS_IMAGE"
          ],
          "advanced": true
        },
        {
          "key": "init_image",
          "title": "RustFS init image",
          "kind": {
            "kind": "string"
          },
          "default": "amazon/aws-cli:latest",
          "required": false,
          "help": "Container image reference (repository:tag or digest). Override to pin or test a different release.",
          "aliases": [
            "RUSTFS_INIT_IMAGE"
          ],
          "advanced": true
        },
        {
          "key": "sts_shim_image",
          "title": "STS shim image",
          "kind": {
            "kind": "string"
          },
          "default": "python:3.13-alpine",
          "required": false,
          "help": "Container image reference (repository:tag or digest). Override to pin or test a different release.",
          "aliases": [
            "STS_SHIM_IMAGE"
          ],
          "advanced": true
        },
        {
          "key": "generic_endpoint_env",
          "title": "Generic endpoint variables",
          "kind": {
            "kind": "bool"
          },
          "default": "false",
          "required": false,
          "help": "Also give clients `AWS_ENDPOINT_URL` and `AWS_ALLOW_HTTP=true`, for tools that don't read `AWS_ENDPOINT_URL_S3`. Off by default: a global endpoint also redirects every AWS SDK client's STS calls.",
          "advanced": true
        }
      ],
      "helpers": [
        {
          "name": "sts-shim",
          "kind": "sidecar"
        },
        {
          "name": "rustfs-init",
          "kind": "init"
        }
      ],
      "hosted": null
    },
    {
      "id": "azurite",
      "model": "azurite",
      "display_name": "Azurite",
      "summary": "Azure Blob emulator; object store with Azure-shaped wiring.",
      "category": "storage",
      "provider_of": "object_store",
      "requires": [],
      "conflicts_with": [],
      "resource_kinds": [
        "object_store"
      ],
      "resource_nouns": [
        {
          "kind": "object_store",
          "singular": "container",
          "plural": "containers"
        }
      ],
      "knobs": [
        {
          "key": "image",
          "title": "Azurite image",
          "kind": {
            "kind": "string"
          },
          "default": "mcr.microsoft.com/azure-storage/azurite:3.35.0",
          "required": false,
          "help": "Container image reference (repository:tag or digest). Override to pin or test a different release.",
          "aliases": [
            "AZURITE_IMAGE"
          ],
          "advanced": true
        },
        {
          "key": "init_image",
          "title": "Azurite init image",
          "kind": {
            "kind": "string"
          },
          "default": "mcr.microsoft.com/azure-cli:2.87.0",
          "required": false,
          "help": "Container image reference (repository:tag or digest). Override to pin or test a different release.",
          "aliases": [
            "AZURITE_INIT_IMAGE"
          ],
          "advanced": true
        }
      ],
      "helpers": [
        {
          "name": "azurite-init",
          "kind": "init"
        }
      ],
      "hosted": null
    },
    {
      "id": "hosted-postgres",
      "model": "postgresql",
      "display_name": "Hosted Postgres",
      "summary": "A managed PostgreSQL server (RDS, Neon, …); databases must already exist.",
      "category": "metadata_db",
      "provider_of": "relational_db",
      "requires": [],
      "conflicts_with": [],
      "resource_kinds": [
        "relational_db"
      ],
      "resource_nouns": [
        {
          "kind": "relational_db",
          "singular": "database",
          "plural": "databases"
        }
      ],
      "knobs": [],
      "helpers": [],
      "hosted": {
        "kind": "postgres",
        "default": {
          "connection": {
            "kind": "postgres",
            "host": "${PGHOST}",
            "port": 5432,
            "database": "{name}",
            "username": "${PGUSER}",
            "password": "${PGPASSWORD}"
          }
        }
      }
    },
    {
      "id": "aws-s3",
      "model": "amazonS3",
      "display_name": "Amazon S3",
      "summary": "Amazon S3 or an S3-compatible store; buckets must already exist.",
      "category": "storage",
      "provider_of": "object_store",
      "requires": [],
      "conflicts_with": [],
      "resource_kinds": [
        "object_store"
      ],
      "resource_nouns": [
        {
          "kind": "object_store",
          "singular": "bucket",
          "plural": "buckets"
        }
      ],
      "knobs": [],
      "helpers": [],
      "hosted": {
        "kind": "s3",
        "default": {
          "cloud": "aws",
          "connection": {
            "kind": "s3",
            "region": "us-east-1",
            "bucket": "{name}",
            "access_key_id": "${AWS_ACCESS_KEY_ID}",
            "secret_access_key": "${AWS_SECRET_ACCESS_KEY}"
          }
        }
      }
    },
    {
      "id": "azure-storage",
      "model": "azureBlobStorage",
      "display_name": "Azure Storage",
      "summary": "An Azure storage account (Blob / ADLS Gen2); containers must already exist.",
      "category": "storage",
      "provider_of": "object_store",
      "requires": [],
      "conflicts_with": [],
      "resource_kinds": [
        "object_store"
      ],
      "resource_nouns": [
        {
          "kind": "object_store",